{
  "$id": "bureau_entity_sheet_v1.schema.json", "$schema": "https://json-schema.org/draft/2020-12/schema",
  "type": "object", "additionalProperties": false,
  "required": ["schema_version", "artifact_type", "artifact_id", "property_id", "episode_id", "created_at", "generator_version", "upstream_artifacts", "entity_id", "entity_kind", "name", "observable_form", "scale", "materials", "symmetry", "movement", "behavior", "intelligence", "communication", "space_time_relationship", "traveler_interaction", "danger_mechanics", "recognition_signs", "prohibited_generic_descriptions", "continuity_tokens", "allowed_states", "shot_specific_appearance_rules"],
  "properties": {
    "schema_version": {"$ref": "common_defs_v1.schema.json#/$defs/schema_version"}, "artifact_type": {"const": "bureau_entity_sheet_v1"}, "artifact_id": {"$ref": "common_defs_v1.schema.json#/$defs/artifact_id"}, "property_id": {"$ref": "common_defs_v1.schema.json#/$defs/property_id"}, "episode_id": {"$ref": "common_defs_v1.schema.json#/$defs/episode_id"}, "created_at": {"$ref": "common_defs_v1.schema.json#/$defs/created_at"}, "generator_version": {"$ref": "common_defs_v1.schema.json#/$defs/generator_version"}, "upstream_artifacts": {"$ref": "common_defs_v1.schema.json#/$defs/upstream_artifacts"},
    "entity_id": {"$ref": "common_defs_v1.schema.json#/$defs/slug"}, "entity_kind": {"enum": ["creature", "intelligent_entity", "anomalous_object", "machine", "building", "weather_system", "living_geography", "abstract_phenomenon"]}, "name": {"$ref": "common_defs_v1.schema.json#/$defs/nonempty_string"}, "observable_form": {"$ref": "common_defs_v1.schema.json#/$defs/string_list"}, "scale": {"$ref": "common_defs_v1.schema.json#/$defs/string_list"}, "materials": {"$ref": "common_defs_v1.schema.json#/$defs/string_list"}, "symmetry": {"$ref": "common_defs_v1.schema.json#/$defs/string_list"}, "movement": {"$ref": "common_defs_v1.schema.json#/$defs/string_list"}, "behavior": {"$ref": "common_defs_v1.schema.json#/$defs/string_list"}, "intelligence": {"$ref": "common_defs_v1.schema.json#/$defs/string_list"}, "communication": {"$ref": "common_defs_v1.schema.json#/$defs/string_list"}, "space_time_relationship": {"$ref": "common_defs_v1.schema.json#/$defs/string_list"}, "traveler_interaction": {"$ref": "common_defs_v1.schema.json#/$defs/string_list"}, "danger_mechanics": {"$ref": "common_defs_v1.schema.json#/$defs/string_list"}, "recognition_signs": {"$ref": "common_defs_v1.schema.json#/$defs/string_list"}, "prohibited_generic_descriptions": {"$ref": "common_defs_v1.schema.json#/$defs/string_list"}, "continuity_tokens": {"$ref": "common_defs_v1.schema.json#/$defs/tag_list"}, "allowed_states": {"$ref": "common_defs_v1.schema.json#/$defs/tag_list"},
    "shot_specific_appearance_rules": {"type": "array", "minItems": 1, "maxItems": 30, "items": {"type": "object", "additionalProperties": false, "required": ["shot_role", "required_tokens", "observable_rule"], "properties": {"shot_role": {"$ref": "common_defs_v1.schema.json#/$defs/slug"}, "required_tokens": {"$ref": "common_defs_v1.schema.json#/$defs/tag_list"}, "observable_rule": {"$ref": "common_defs_v1.schema.json#/$defs/nonempty_string"}}}}
  }
}
